{
  "id": "neolithic",
  "name": "신석기인의 정착과 농경",
  "type": "culture",
  "date": "-4000-01",
  "location": {
    "name": "서울 암사동",
    "lng": 127.13,
    "lat": 37.56
  },
  "perspectives": {
    "politics": {
      "weight": 85,
      "narrative": "신석기 사람들은 강가와 바닷가의 움집에서 살며 사냥·채집·어로와 농경을 병행했다. 간석기와 토기의 사용은 먹거리를 가공하고 저장하는 생활과 연결된다. 지도는 신석기 생활을 이해할 대표 지역이며, 기원전 4000년은 시대 안의 학습용 대표 시점이다. 신석기 시작 연대를 뜻하지 않는다. 월은 특정하지 않으며 01은 연표 정렬용이다.",
      "sources": [
        "https://encykorea.aks.ac.kr/Article/E0033063"
      ]
    },
    "society": {
      "weight": 80,
      "narrative": "빗살무늬 토기, 갈돌·갈판, 가락바퀴와 뼈바늘을 생활 기능으로 묶어 기억하자. 토기는 저장·조리, 갈돌은 식물성 식량 가공, 가락바퀴와 뼈바늘은 의생활의 단서다. 농경이 시작되었다고 수렵과 어로가 사라진 것은 아니며, 청동기 지배층 무덤인 고인돌과 구분해야 한다.",
      "sources": [
        "https://encykorea.aks.ac.kr/Article/E0033063"
      ]
    }
  }
}
