{
  "id": "uisang",
  "name": "의상과 화엄 신앙의 확산",
  "type": "culture",
  "date": "0676-01",
  "location": {
    "name": "영주 부석사",
    "lng": 128.69,
    "lat": 36.998
  },
  "perspectives": {
    "politics": {
      "weight": 85,
      "narrative": "의상 계통의 화엄 신앙은 부석사를 비롯한 사찰을 중심으로 퍼졌다. 676년은 부석사 창건 전승과 연결되는 학습 시점이다. 화엄의 세계관은 개별 존재가 서로 관계를 맺는다는 이해를 강조했다. 신라 불교를 수도의 왕실 후원만으로 보지 않고 지방 사찰의 연결망 속에서 볼 필요가 있다. 월은 특정하지 않으며 01은 연표 정렬용이다.",
      "sources": [
        "https://encykorea.aks.ac.kr/Article/E0064809"
      ]
    },
    "society": {
      "weight": 80,
      "narrative": "화엄십찰은 의상과 그 제자 계통의 교화 거점을 보여 주지만 목록의 모든 사찰을 의상이 직접 세운 것은 아니다. 해인사처럼 그가 죽은 뒤 세워진 사찰도 포함되기 때문이다. 원효의 화쟁·대중화와 의상의 화엄·부석사를 비교하고, 지금 보는 사찰 건물의 건립 시기와 사찰의 창건 시기를 구분한다.",
      "sources": [
        "https://encykorea.aks.ac.kr/Article/E0064809"
      ]
    }
  }
}
