{
  "id": "hansan",
  "name": "한산도 대첩과 해상 보급로",
  "type": "battle",
  "date": "1592-07",
  "location": {
    "lng": 128.48,
    "lat": 34.76
  },
  "perspectives": {
    "state": {
      "name": "정책과 지배 질서",
      "weight": 90,
      "narrative": "이순신 등이 지휘한 조선 수군은 한산도 앞바다에서 일본 수군을 크게 물리쳤다. 해전의 의미는 육상의 전쟁과 분리되지 않는다. 일본군의 해상 활동과 보급 구상에 제약을 주어 조선의 항전 여건을 지켰다는 점을 지도에서 남해의 위치와 함께 이해한다. 날짜는 출처의 음력 7월을 기준으로 표시했다.",
      "sources": [
        "https://encykorea.aks.ac.kr/Article/E0061676"
      ]
    },
    "society": {
      "name": "사람과 사회의 변화",
      "weight": 85,
      "narrative": "전투에는 지휘관뿐 아니라 수군 병사, 배와 무기를 만들고 보급한 사람들의 노동이 필요했다. 한산도는 1592년, 명량은 1597년, 노량은 1598년으로 묶어 비교한다. 임진왜란의 대표 승전인 진주대첩과 행주대첩은 육상 전투이므로 위치와 전투 양상을 구별한다. 지도 표시는 사건의 중심지 또는 관련 대표 지역이며 영향 범위 전체를 뜻하지 않는다.",
      "sources": [
        "https://encykorea.aks.ac.kr/Article/E0061676"
      ]
    }
  }
}
