{
  "id": "seohee",
  "name": "서희의 담판과 강동 6주",
  "type": "political",
  "date": "0993-01",
  "location": {
    "name": "안주 일대",
    "lng": 125.66,
    "lat": 39.62
  },
  "perspectives": {
    "politics": {
      "weight": 85,
      "narrative": "993년 거란이 침입하자 서희는 소손녕과 담판했다. 고려의 고구려 계승성을 주장하고 여진이 가로막은 교통 문제를 논리로 삼아 강동 지역 진출의 명분을 확보했다. 이후 압록강 동쪽에 6주가 설치되었다. 지도는 협상과 전선 이해를 돕는 대표 지점이며 강동 6주 전체를 한 점으로 확정한 것은 아니다. 월은 특정하지 않으며 01은 연표 정렬용이다.",
      "sources": [
        "https://encykorea.aks.ac.kr/Article/E0028321"
      ]
    },
    "society": {
      "weight": 80,
      "narrative": "거란은 고려와 송의 관계를 견제하려 했고 고려는 군사적 압박 속에서 실리를 추구했다. 말솜씨만으로 영토가 생겼다고 단순화하지 말고 외교적 이해와 실제 개척을 함께 본다. 서희·거란·강동 6주와 윤관·여진·동북 9성을 비교하면 북방 영토 문제의 대표 함정을 피할 수 있다.",
      "sources": [
        "https://encykorea.aks.ac.kr/Article/E0028321"
      ]
    }
  }
}
