{
  "id": "clock",
  "name": "장영실 등의 자격루 제작",
  "type": "culture",
  "date": "1434-01",
  "location": {
    "lng": 126.977,
    "lat": 37.579
  },
  "perspectives": {
    "state": {
      "name": "정책과 지배 질서",
      "weight": 90,
      "narrative": "세종은 장영실·이천 등에게 자동으로 시각을 알리는 자격루를 제작하게 했다. 천문 관측과 시간 측정은 농업뿐 아니라 국가 의례와 행정의 기준을 세우는 일이었다. 자격루는 물시계이며 앙부일구는 해시계이므로 이름과 원리를 서로 바꾸지 않도록 한다. 월은 확인되지 않아 연도 중심으로 표시했다(01은 임시값).",
      "sources": [
        "https://encykorea.aks.ac.kr/Article/E0047854"
      ]
    },
    "society": {
      "name": "사람과 사회의 변화",
      "weight": 85,
      "narrative": "과학 기술 발전에는 기술자들의 제작 경험과 국가의 지원이 함께 필요했다. 장영실의 활동은 재능을 활용한 인재 등용의 사례이지만 조선의 신분제가 사라졌다는 뜻은 아니다. 오늘날 남은 자격루 유물과 세종 때 최초 제작의 연대를 동일시하지 않는 것도 중요하다. 지도 표시는 사건의 중심지 또는 관련 대표 지역이며 영향 범위 전체를 뜻하지 않는다.",
      "sources": [
        "https://encykorea.aks.ac.kr/Article/E0047854"
      ]
    }
  }
}
