{
  "id": "gyeongsin",
  "name": "경신환국과 정국의 급변",
  "type": "political",
  "date": "1680-01",
  "location": {
    "lng": 126.978,
    "lat": 37.5665
  },
  "perspectives": {
    "state": {
      "name": "정책과 지배 질서",
      "weight": 90,
      "narrative": "숙종은 경신환국을 통해 남인을 밀어내고 서인을 등용했다. 환국은 집권 붕당이 급격히 교체되는 정치 운영을 뜻한다. 이후 기사환국에서는 남인, 갑술환국에서는 서인이 집권하는 흐름을 연결하며 국왕이 정국 변화의 주도권을 강화한 점을 파악한다. 월은 확인되지 않아 연도 중심으로 표시했다(01은 임시값).",
      "sources": [
        "https://encykorea.aks.ac.kr/Article/E0002637"
      ]
    },
    "society": {
      "name": "사람과 사회의 변화",
      "weight": 85,
      "narrative": "상대 붕당을 공존의 대상으로 인정하는 기반이 약해지고 처벌과 배제가 심해졌다. 정치적 승패는 개인과 가문의 생존에 직결되었다. 서인은 뒤에 노론과 소론으로 갈라졌으며, 이 같은 대립을 조정하려는 영조의 탕평책이 등장하는 배경이 되었다. 지도 표시는 사건의 중심지 또는 관련 대표 지역이며 영향 범위 전체를 뜻하지 않는다.",
      "sources": [
        "https://encykorea.aks.ac.kr/Article/E0002637"
      ]
    }
  }
}
