{
  "id": "foundation",
  "name": "왕건의 고려 건국",
  "type": "political",
  "date": "0918-01",
  "location": {
    "name": "철원 궁예도성 일대",
    "lng": 127.3,
    "lat": 38.3
  },
  "perspectives": {
    "politics": {
      "weight": 85,
      "narrative": "왕건은 궁예를 몰아낸 세력의 추대를 받아 918년 고려를 세웠고 이듬해 송악으로 수도를 옮겼다. 고구려 계승 의식을 드러낸 국호와 함께 지역 세력을 포섭하며 통합을 추진했다. 지도는 918년 즉위가 이루어진 철원 일대이며 정확한 전각의 좌표를 확정한 것은 아니다. 월은 특정하지 않으며 01은 연표 정렬용이다.",
      "sources": [
        "https://encykorea.aks.ac.kr/Article/E0059032"
      ]
    },
    "society": {
      "weight": 80,
      "narrative": "호족에게 혼인과 사성으로 유대를 맺는 방식은 새 왕조의 협력 기반을 넓혔다. 동시에 사심관과 기인 제도는 지방 세력과 중앙의 관계를 조정하는 수단이었다. 태조의 정책은 포섭과 견제의 양면으로 이해하고, 광종의 노비안검법·과거제와 구별한다.",
      "sources": [
        "https://encykorea.aks.ac.kr/Article/E0059032"
      ]
    }
  }
}
