{
  "id": "cultural-rule",
  "name": "문화 통치 표방과 식민 지배의 지속",
  "type": "political",
  "date": "1919-08",
  "location": {
    "lng": 126.978,
    "lat": 37.566
  },
  "perspectives": {
    "institutions": {
      "name": "제도와 권력의 변화",
      "weight": 95,
      "narrative": "3·1 운동 뒤 일본은 통치 방식을 바꾸겠다고 선언했다. 헌병 경찰을 보통 경찰로 바꾸고 일부 신문 발행과 교육 기회를 허용했지만 경찰 조직과 감시는 오히려 확대되었다. 이른바 문화 통치는 식민 지배를 안정시키려는 방식 변화였으며, 조선인의 주권 회복이나 차별 철폐를 뜻하지 않았다.",
      "sources": [
        "https://encykorea.aks.ac.kr/Article/E0047318"
      ]
    },
    "people": {
      "name": "사람들의 대응과 생활",
      "weight": 90,
      "narrative": "조선일보·동아일보 등은 여론과 계몽의 통로가 되었으나 검열·정간의 제약을 받았다. 공개적으로 활동할 공간이 일부 생긴 점과 그 공간이 통제받았다는 점을 함께 보아야 한다. 1920년대 실력 양성 운동과 노동·농민·청년 운동의 확대는 이런 제한된 조건 속에서 이루어졌다.",
      "sources": [
        "https://encykorea.aks.ac.kr/Article/E0047318"
      ]
    }
  }
}
