{
  "id": "bulguksa",
  "name": "불국사와 석굴암 조영",
  "type": "culture",
  "date": "0751-01",
  "location": {
    "name": "경주 불국사",
    "lng": 129.332,
    "lat": 35.789
  },
  "perspectives": {
    "politics": {
      "weight": 85,
      "narrative": "경덕왕 때 김대성이 불국사와 석굴암 조영을 추진했다. 751년은 조영 시작의 기준이며 현재 보이는 모든 건물이 그때 모습 그대로 남은 것은 아니다. 불교 신앙과 왕경의 경제력, 뛰어난 석조 기술이 결합한 사례로 읽으면 건축물 사진과 시대를 연결하는 문제를 풀기 쉽다. 월은 특정하지 않으며 01은 연표 정렬용이다.",
      "sources": [
        "https://encykorea.aks.ac.kr/Article/E0024933"
      ]
    },
    "society": {
      "weight": 80,
      "narrative": "불국사의 다보탑과 석가탑은 서로 다른 형태를 지닌 통일신라 석탑이다. 석가탑에서 발견된 무구정광대다라니경은 목판 인쇄와 연결된다. 고려의 금속활자본 『직지』와 기술을 구별하자. 화려한 신앙 공간을 만든 장인의 기술과 많은 자원의 동원도 문화유산을 해석할 때 함께 살펴야 한다.",
      "sources": [
        "https://encykorea.aks.ac.kr/Article/E0024933"
      ]
    }
  }
}
